name,description
Alfentanil,"A rapid-acting opioid analgesic used for short-duration pain management, often as an adjunct to general anesthesia."
Alimemazine,An antihistamine primarily used for its sedative and anxiolytic effects in the short-term treatment of insomnia and anxiety.
Alitretinoin,A retinoid used topically to treat severe chronic hand eczema unresponsive to potent topical corticosteroids.
Almasilate,"An antacid containing aluminum and magnesium, used to neutralize stomach acid and relieve symptoms of heartburn and indigestion."
Alosetron,A selective 5-HT3 receptor antagonist indicated for the treatment of severe diarrhea-predominant irritable bowel syndrome (IBS-D) in women.
Alprenolol,"A non-selective beta-adrenergic blocker used to treat hypertension, angina pectoris, and certain cardiac arrhythmias."
Alum,"Functions as an astringent and antiseptic, often used topically to constrict tissues, stop minor bleeding, or reduce sweating."
Aluminium,"As a metal, its various salts and compounds are widely used in medicine for their astringent, antacid, or phosphate-binding properties."
Aluminum Hydroxide,"Acts as an antacid to relieve heartburn and indigestion, and as a phosphate binder to reduce high phosphate levels in kidney disease."
Aluminum Oxide,"Used as an abrasive in dental and dermatological preparations for polishing and exfoliation, and as a component in some sunscreens for UV protection."
Aluminum Sulfate,"Utilized as an astringent and styptic in topical preparations to contract tissues, reduce secretions, and control minor bleeding."
Alvimopan,A peripherally acting mu-opioid receptor antagonist used to accelerate gastrointestinal recovery following partial large or small bowel resection with primary anastomosis.
Ambenonium,A cholinesterase inhibitor used in the symptomatic treatment of myasthenia gravis to improve muscle strength.
Amcinonide,A topical corticosteroid used for the relief of inflammatory and pruritic manifestations of corticosteroid-responsive dermatoses.
Aminocaproic Acid,"An antifibrinolytic agent used to prevent or reduce hemorrhage by inhibiting fibrinolysis in various conditions, such as during surgery or in certain bleeding disorders."
Aminoglutethimide,An aromatase inhibitor and adrenal steroidogenesis inhibitor used in the treatment of metastatic breast cancer in postmenopausal women and Cushing's syndrome.
Aminohippuric Acid,"Used to measure effective renal plasma flow and assess renal tubular function, aiding in the diagnosis of kidney disorders."
Aminolevulinic Acid,"A photosensitizer used in photodynamic therapy for the treatment of actinic keratosis and superficial basal cell carcinoma, and as a diagnostic aid in certain cancers."
Aminophenazone,Historically used as an analgesic and antipyretic for pain and fever relief. Its use is now restricted due to safety concerns.
Aminosalicylic Acid,An antibiotic used as a second-line agent in combination therapy for the treatment of multidrug-resistant tuberculosis.
Amobarbital,"A barbiturate with sedative-hypnotic properties, used for short-term treatment of insomnia, relief of anxiety, and as a pre-anesthetic sedative."
Amphetamine,A central nervous system stimulant used to treat attention deficit hyperactivity disorder (ADHD) and narcolepsy.
Amprenavir,An antiretroviral protease inhibitor used in combination with other drugs for the treatment of HIV infection.
Amrubicin,"An anthracycline topoisomerase II inhibitor used as a chemotherapy agent for the treatment of certain cancers, particularly non-small cell lung cancer."
Amsacrine,A DNA intercalating topoisomerase II inhibitor used as a chemotherapy agent in the treatment of acute myeloid leukemia (AML).
Amyl Nitrite,A rapid-acting vasodilator primarily used for the acute relief of angina pectoris and as an antidote for cyanide poisoning.
Anagrelide,Anagrelide is an oral antiplatelet agent used to reduce elevated platelet counts in patients with essential thrombocythemia. It functions by inhibiting megakaryocyte maturation.
Anisotropine Methylbromide,Anisotropine methylbromide is an anticholinergic antispasmodic agent used to relieve smooth muscle spasms in the gastrointestinal tract. It helps manage symptoms of irritable bowel syndrome.
Antazoline,"Antazoline is an H1-receptor antagonist used topically, often in combination with a decongestant, to relieve ocular itching and redness associated with allergic conjunctivitis."
Antipyrine,"Antipyrine is an analgesic and antipyretic agent, primarily used in combination with benzocaine in otic solutions. It helps relieve pain and inflammation associated with acute otitis media."
Aprindine,"Aprindine is a Class IC antiarrhythmic agent that blocks fast sodium channels, used to treat various ventricular and supraventricular tachyarrhythmias. Its use is limited due to potential toxicity."
Arbekacin,"An aminoglycoside antibiotic primarily used for treating serious bacterial infections, including those caused by multidrug-resistant strains like MRSA."
Arbutamine,A beta-1 adrenergic agonist used as a pharmacologic stress agent in cardiac imaging to simulate exercise and evaluate myocardial ischemia.
Argatroban,A direct thrombin inhibitor used as an anticoagulant for the prophylaxis or treatment of thrombosis in patients with heparin-induced thrombocytopenia (HIT).
Arotinolol,"A beta-blocker with additional alpha-1 blocking properties, used for managing essential hypertension, angina pectoris, and certain arrhythmias."
Articaine,"An amide-type local anesthetic with a rapid onset and intermediate duration of action, commonly used for local or regional anesthesia in dental procedures."
Asunaprevir,"An antiviral medication classified as an NS3/4A protease inhibitor. It is used in combination with other antivirals to treat chronic hepatitis C virus (HCV) infection, specifically genotypes 1b and 4."
Atovaquone,An antiprotozoal agent used to treat and prevent *Pneumocystis jirovecii* pneumonia (PCP). It is also used in combination with proguanil for the prophylaxis and treatment of malaria.
Atracurium Besylate,A nondepolarizing neuromuscular blocker used as an adjunct to general anesthesia. It facilitates tracheal intubation and provides skeletal muscle relaxation during surgery or mechanical ventilation.
Aurothiomalate,"A gold salt used as a disease-modifying antirheumatic drug (DMARD). It is indicated for the treatment of active rheumatoid arthritis, particularly in patients who have not responded to other therapies."
Azatadine,"A first-generation H1-antihistamine used to relieve symptoms of seasonal and perennial allergic rhinitis, such as sneezing, rhinorrhea, and pruritus. It also treats chronic idiopathic urticaria."
Azidocillin,"A penicillin antibiotic used for treating bacterial infections, particularly those caused by susceptible Gram-positive organisms like streptococci and staphylococci."
Azlocillin,"An extended-spectrum penicillin antibiotic effective against a broad range of Gram-negative bacteria, including Pseudomonas aeruginosa, in treating severe infections."
Barnidipine,A dihydropyridine calcium channel blocker used for the treatment of essential hypertension by causing vasodilation and reducing peripheral resistance.
Bazedoxifene,A selective estrogen receptor modulator (SERM) used for the treatment and prevention of postmenopausal osteoporosis.
Beclomethasone Dipropionate,"A potent corticosteroid with anti-inflammatory and immunosuppressive properties, primarily used in inhaled formulations for asthma and rhinitis, or topically for skin conditions."
Bedaquiline,An antimicrobial used to treat adults with pulmonary multidrug-resistant tuberculosis (MDR-TB) as part of a combination regimen.
Belinostat,A histone deacetylase (HDAC) inhibitor used to treat relapsed or refractory peripheral T-cell lymphoma (PTCL).
Bendroflumethiazide,A thiazide diuretic used to manage edema associated with congestive heart failure and to treat hypertension.
Benzatropine,An anticholinergic agent used to treat parkinsonism and to control drug-induced extrapyramidal disorders.
Benznidazole,An antiparasitic medication primarily used for the treatment of Chagas disease (American trypanosomiasis).
Benzoctamine,A tranquilizer used for the short-term treatment of anxiety states and tension.
Benzophenone,Primarily used as a UV filter in sunscreens and other topical preparations to protect against ultraviolet radiation.
Benzphetamine,A sympathomimetic amine used as an appetite suppressant for the short-term management of exogenous obesity.
Benzylpenicillin,"A beta-lactam antibiotic (Penicillin G) effective against a wide range of gram-positive bacteria, used to treat various bacterial infections including syphilis and serious streptococcal infections."
Bepridil,"A calcium channel blocker used to treat chronic stable angina pectoris, particularly when other antianginal agents are ineffective or not tolerated."
Bethanidine,"An adrenergic neuron blocking agent previously used to treat moderate to severe hypertension, primarily when other antihypertensives were ineffective."
Betrixaban,A direct factor Xa inhibitor anticoagulant used for the prophylaxis of venous thromboembolism (VTE) in adult patients hospitalized for an acute medical illness.
Bevantolol,A beta-adrenergic receptor blocking agent that was investigated for its use in treating hypertension and angina pectoris.
Bexarotene,A retinoid used for the treatment of cutaneous T-cell lymphoma (CTCL) in patients who are refractory to at least one prior systemic therapy.
Biperiden,"An anticholinergic agent primarily used to treat all forms of Parkinson's disease, particularly drug-induced parkinsonism and extrapyramidal symptoms."
Bismuth Subcitrate,Used as an anti-ulcer agent and in combination therapies to eradicate Helicobacter pylori infections by inhibiting bacterial growth and protecting the gastric mucosa.
Bismuth Subsalicylate,"An antidiarrheal and antacid agent used to treat temporary discomforts of the stomach and gastrointestinal tract, such as nausea, indigestion, and diarrhea."
Boceprevir,"An antiviral drug, specifically a protease inhibitor, used in combination with peginterferon alfa and ribavirin for the treatment of chronic hepatitis C genotype 1 infection."
Bopindolol,A non-selective beta-adrenoceptor antagonist used primarily in the management of hypertension and angina pectoris.
Bretylium,An antiarrhythmic agent primarily used for the treatment of life-threatening ventricular fibrillation and refractory ventricular tachycardia.
Brexpiprazole,An atypical antipsychotic used to treat schizophrenia and as an adjunctive treatment for major depressive disorder.
Brigatinib,A kinase inhibitor used to treat anaplastic lymphoma kinase (ALK)-positive metastatic non-small cell lung cancer.
Bromazepam,A benzodiazepine anxiolytic used for the short-term symptomatic treatment of anxiety and panic disorders.
Bromopride,"A prokinetic and antiemetic agent used to treat nausea, vomiting, and symptoms of gastroesophageal reflux disease."
Brompheniramine,"An antihistamine used to relieve symptoms of allergies, such as sneezing, runny nose, and watery eyes."
Brotizolam,A thienotriazolodiazepine used as a short-acting hypnotic for the short-term treatment of insomnia due to its sedative and anxiolytic properties.
Bumetanide,"A loop diuretic used to treat edema associated with congestive heart failure, hepatic cirrhosis, and renal disease, by promoting increased excretion of water and electrolytes."
Bupranolol,"A non-selective beta-blocker used in the treatment of hypertension, angina pectoris, and for reducing intraocular pressure in glaucoma."
Butabarbital,"A barbiturate used for its sedative and hypnotic effects, primarily for short-term treatment of insomnia or as a pre-operative sedative."
Butalbital,"A barbiturate commonly used in combination with other analgesics (e.g., acetaminophen, aspirin, caffeine) for the symptomatic relief of tension headaches."
Butamben,"Butamben is a local anesthetic used to relieve pain and itching from minor burns, insect bites, or skin irritations. It blocks nerve signals in the body."
Butobarbital,Butobarbital is a barbiturate derivative used as a sedative and hypnotic. It is employed for its central nervous system depressant effects to induce sleep or reduce anxiety.
Butoconazole,Butoconazole is an imidazole antifungal agent primarily used to treat vulvovaginal candidiasis (yeast infections). It works by inhibiting the growth of fungi.
Butylscopolamine,"Butylscopolamine (also known as hyoscine butylbromide) is an antispasmodic agent used to relieve cramps and spasms of the gastrointestinal tract, bladder, and bile duct. It works by relaxing smooth muscles."
Calcifediol,Calcifediol is a vitamin D analog used to treat secondary hyperparathyroidism in patients with chronic kidney disease on dialysis. It helps regulate calcium and phosphate levels.
Camazepam,A benzodiazepine derivative used for the short-term treatment of anxiety disorders.
Candesartan Cilexetil,An angiotensin II receptor blocker (ARB) prodrug used to treat hypertension and heart failure.
Cangrelor,An intravenous direct-acting P2Y12 platelet inhibitor used to reduce thrombotic events in patients undergoing percutaneous coronary intervention.
Cannabidiol,A non-psychoactive cannabinoid used to treat seizures associated with specific epilepsy syndromes like Lennox-Gastaut syndrome and Dravet syndrome.
Canrenoic Acid,"An active metabolite of spironolactone and an aldosterone antagonist, used to manage conditions associated with excessive aldosterone such as ascites and edema."
Captodiame,A non-benzodiazepine anxiolytic and muscle relaxant used to alleviate anxiety and muscle tension.
Carbamoylcholine,A cholinergic agonist used topically to induce miosis during ophthalmic surgery or to reduce intraocular pressure in glaucoma.
Carbinoxamine,"An antihistamine used to relieve symptoms of allergic rhinitis, such as sneezing, runny nose, and itchy eyes."
Carboprost Tromethamine,A prostaglandin analog used to induce abortion in the second trimester and to control refractory postpartum hemorrhage.
Carprofen,A non-steroidal anti-inflammatory drug (NSAID) primarily used in veterinary medicine for pain and inflammation relief in dogs.
Carteolol,"A non-selective beta-adrenergic blocker used topically to reduce intraocular pressure in glaucoma and ocular hypertension. Systemically, it treats hypertension and angina pectoris."
Cation,"A general chemical term referring to a positively charged ion, not a specific pharmaceutical composition with direct clinical use."
Cefacetrile,A first-generation cephalosporin antibiotic used to treat a wide range of bacterial infections susceptible to its action.
Cefaloridine,"A first-generation cephalosporin antibiotic used for treating bacterial infections, active against susceptible Gram-positive and some Gram-negative bacteria."
Cefalotin,"A first-generation cephalosporin antibiotic used to treat various bacterial infections, including those of the respiratory tract, skin, and urinary tract."
Cefamandole,"A second-generation cephalosporin antibiotic used to treat bacterial infections of the respiratory tract, urinary tract, skin, and bones."
Cefapirin,"A first-generation cephalosporin antibiotic used for treating susceptible bacterial infections, including skin and soft tissue, respiratory, and urinary tract infections, and for surgical prophylaxis."
Cefmenoxime,"A third-generation cephalosporin antibiotic used to treat serious bacterial infections such as lower respiratory tract, urinary tract, and intra-abdominal infections."
Cefmetazole,"A cephamycin antibiotic effective against aerobic and anaerobic bacteria, primarily used for surgical prophylaxis and treatment of intra-abdominal and gynecological infections."
Cefonicid,"A second-generation cephalosporin antibiotic used to treat bacterial infections of the lower respiratory tract, urinary tract, skin and soft tissue, and bone and joint, and for surgical prophylaxis."
Ceforanide,"Ceforanide is a second-generation cephalosporin antibiotic used to treat bacterial infections, including those of the respiratory tract, urinary tract, and skin, and for surgical prophylaxis."
Cefotetan,"Cefotetan is a second-generation cephamycin antibiotic effective against a broad spectrum of bacteria, including anaerobes, used for surgical prophylaxis and treating intra-abdominal and gynecological infections."
Cefotiam,"Cefotiam is a third-generation cephalosporin antibiotic used to treat various bacterial infections, such as those affecting the respiratory and urinary tracts, skin, and soft tissues."
Cefoxitin,"Cefoxitin is a second-generation cephamycin antibiotic effective against a wide range of bacteria, including anaerobes, used for surgical prophylaxis and the treatment of intra-abdominal and gynecological infections."
Cefpiramide,"Cefpiramide is a third-generation cephalosporin antibiotic used to treat serious bacterial infections, including septicemia, pneumonia, and complicated urinary tract infections."
Cefpodoxime,"Cefpodoxime is a third-generation cephalosporin antibiotic used to treat bacterial infections of the respiratory tract, urinary tract, and skin."
Cefradine,"Cefradine is a first-generation cephalosporin antibiotic effective against various Gram-positive and some Gram-negative bacterial infections, including those of the respiratory and urinary tracts."
Ceftobiprole,"Ceftobiprole is a fifth-generation cephalosporin antibiotic with activity against methicillin-resistant Staphylococcus aureus (MRSA) and Pseudomonas aeruginosa, used for complicated skin and soft tissue infections."
Cephaloglycin,"Cephaloglycin is an oral first-generation cephalosporin antibiotic, historically used for treating urinary tract infections."
Cerulenin,Cerulenin is an antifungal antibiotic that inhibits fatty acid synthesis. It is investigated for its antimicrobial properties and potential as an anticancer agent.
Cevimeline,A muscarinic agonist used to treat symptoms of dry mouth (xerostomia) in patients with Sjgren's syndrome by increasing saliva secretion.
Chenodeoxycholic Acid,A primary bile acid used to dissolve cholesterol gallstones or to treat specific liver disorders like primary biliary cholangitis.
Chloral,"A compound known for its hypnotic and sedative properties, historically used to induce sleep or calm agitation."
Chloropyramine,"A first-generation antihistamine used to relieve symptoms of allergic reactions such as rhinitis, urticaria, and conjunctivitis."
Chlorothiazide,A thiazide diuretic used to treat hypertension and edema by increasing the excretion of sodium and water from the body.
Chloroxine,"An antimicrobial agent primarily used topically to treat skin infections, including those caused by fungi and bacteria. It functions as an antiseptic and antifungal."
Chloroxylenol,"A broad-spectrum antimicrobial compound used as an antiseptic and disinfectant. It is commonly found in surgical scrubs, skin cleansers, and household disinfectants."
Chlorphenesin,"An antifungal and antibacterial agent, often used as a preservative in cosmetics and topical medications. It also has muscle relaxant properties, though less commonly used systemically for this purpose."
Chlorprothixene,A typical antipsychotic medication used to manage psychotic disorders such as schizophrenia and the manic phase of bipolar disorder. It helps reduce symptoms like hallucinations and delusions.
Chlortetracycline,"A broad-spectrum tetracycline antibiotic used to treat various bacterial infections. It inhibits bacterial protein synthesis, making it effective against a range of gram-positive and gram-negative bacteria."
Cholecalciferol,"Used to treat or prevent vitamin D deficiency, osteomalacia, and rickets. It aids in the absorption of calcium and phosphorus for bone health."
Cholic Acid,Used to treat bile acid synthesis disorders due to single enzyme defects and peroxisomal disorders by replacing deficient primary bile acids.
Choline Trisalicylate,"A nonsteroidal anti-inflammatory drug (NSAID) used to relieve mild to moderate pain, fever, and inflammation, often associated with arthritis."
Cidofovir,An antiviral medication primarily used for the treatment of cytomegalovirus (CMV) retinitis in patients with AIDS.
Cilazapril,An ACE inhibitor used to treat essential hypertension (high blood pressure) and congestive heart failure.
Cinchocaine,"A local anesthetic used topically to relieve pain, itching, and discomfort caused by conditions such as hemorrhoids or minor skin irritations."
Cinoxacin,A quinolone antibiotic primarily used to treat acute and chronic urinary tract infections caused by susceptible bacteria.
Clenbuterol,A beta-2 adrenergic agonist used as a bronchodilator to treat respiratory conditions like asthma and chronic obstructive pulmonary disease (COPD).
Clevidipine,An intravenous dihydropyridine calcium channel blocker used for the rapid reduction of blood pressure in hypertensive emergencies.
Clocortolone,"A topical corticosteroid used to reduce inflammation, itching, and redness associated with various skin conditions such as eczema and dermatitis."
Clodronic Acid,"A bisphosphonate used to inhibit bone resorption, primarily in the management of hypercalcemia of malignancy and osteolytic bone metastases."
Clofibrate,"A fibric acid derivative used to lower elevated serum triglyceride and cholesterol levels, particularly in hyperlipidemias."
Clomifene,"A selective estrogen receptor modulator (SERM) used to induce ovulation in anovulatory women with intact hypothalamic-pituitary function, often for fertility treatment."
Clomocycline,"A tetracycline antibiotic used to treat a wide range of bacterial infections, including those of the respiratory, urinary, and gastrointestinal tracts."
Clonixin,A non-steroidal anti-inflammatory drug (NSAID) primarily used for its analgesic and anti-inflammatory effects in the treatment of various pain conditions.
Clorazepic Acid,"A benzodiazepine anxiolytic used to treat anxiety disorders, acute alcohol withdrawal, and as an adjunctive treatment for partial seizures."
Clotiazepam,"A thienodiazepine with anxiolytic, sedative, and muscle relaxant properties, primarily used for anxiety disorders and insomnia."
Cloxazolam,A benzodiazepine derivative used for the short-term treatment of anxiety disorders and psychosomatic illnesses with associated anxiety.
Cobicistat,"A pharmacokinetic enhancer that inhibits CYP3A, used to boost the plasma levels of co-administered antiretroviral drugs in HIV treatment."
Cobimetinib,A MEK inhibitor used in combination with other agents for the treatment of BRAF V600 mutation-positive unresectable or metastatic melanoma.
Cocaine,"A potent local anesthetic and vasoconstrictor, sometimes used topically for anesthesia of mucous membranes in diagnostic or surgical procedures of the nose, throat, and larynx."
Colistin,"A polymyxin antibiotic used to treat severe infections caused by multi-drug resistant Gram-negative bacteria, including Pseudomonas aeruginosa and Acinetobacter baumannii."
Copanlisib,A phosphoinositide 3-kinase (PI3K) inhibitor used for the treatment of adult patients with relapsed follicular lymphoma who have received at least two prior systemic therapies.
Corticorelin Ovine Triflutate,A synthetic ovine corticotropin-releasing hormone (CRH) used as a diagnostic agent to differentiate between pituitary-dependent Cushing's disease and ectopic ACTH syndrome.
Cortisone Acetate,"A synthetic corticosteroid with anti-inflammatory and immunosuppressive properties, used in the treatment of adrenal insufficiency and various inflammatory or allergic conditions."
Crisaborole,Crisaborole is a non-steroidal phosphodiesterase-4 inhibitor applied topically for the treatment of mild to moderate atopic dermatitis.
Cyamemazine,"Cyamemazine is a phenothiazine antipsychotic with sedative and anxiolytic properties, used to manage psychomotor agitation and certain psychotic disorders."
Cyclacillin,"Cyclacillin is an aminopenicillin antibiotic used to treat bacterial infections, particularly those of the respiratory tract, urinary tract, and skin."
Cyclizine,"Cyclizine is an antihistamine with antiemetic properties, used for the prevention and treatment of nausea, vomiting, and dizziness, especially from motion sickness."
Cyclosporine,Cyclosporine is an immunosuppressant calcineurin inhibitor used to prevent organ rejection in transplant recipients and to treat certain autoimmune conditions.
Cyclothiazide,A thiazide diuretic used to manage hypertension and fluid retention (edema) associated with various conditions.
Cyproterone Acetate,"An antiandrogen and progestogen used to treat androgen-dependent conditions such as prostate cancer, severe hirsutism, and acne."
Cysteamine,An aminothiol used to reduce cystine accumulation in various organs in patients with nephropathic cystinosis.
Dabrafenib,"A BRAF kinase inhibitor used to treat specific cancers, including melanoma and non-small cell lung cancer, that have a BRAF V600E mutation."
Dalfopristin,A streptogramin antibiotic component typically used in combination with quinupristin to treat serious infections caused by multidrug-resistant Gram-positive bacteria.
Dantrolene,A direct-acting skeletal muscle relaxant used to treat spasticity associated with neurological disorders and as a specific antidote for malignant hyperthermia.
Dapiprazole,An alpha-1 adrenergic antagonist used topically to reverse pharmacologically induced mydriasis following ophthalmic examination.
Dasabuvir,A non-nucleoside NS5B polymerase inhibitor used in combination with other direct-acting antivirals to treat chronic hepatitis C virus genotype 1 infection.
Debrisoquine,"An adrenergic neuron blocking antihypertensive agent, primarily used as a probe drug for assessing cytochrome P450 2D6 metabolic capacity."
